id,title,category,brand,modelno,price,cluster_id
walmart_581,elite screens cinewhite cinema235 series fixed frame wide screen - 85 diagonal,electronics - general,elite screens,r85wh1-wide,409.0,847
walmart_1502,san diego padres iphone 4 case silicone cover,electronics - general,tribeca,fva3959,24.99,847
walmart_337,innovera d3010 black compatible high-yield toner print cartridge,stationery & office machinery,innovera,d3010,68.35,667
walmart_53,da-lite da-plex base rear projection screen - 57 3 4 x 77 video format,electronics - general,da-lite,27528,2608.99,595
walmart_1560,pc treasures wireless optical mouse 2.4 ghz purple,mice,pc treasures,07227,17.82,443
walmart_2019,hon metal bookcase 34-1 2w x 12-5 8d x 81-1 8h,furniture,hon,s82abcp,369.0,586
walmart_2422,msi ati radeon hd6670 1gb ddr5 pci-express video card,electronics - general,msi,r6670-md1gd5,107.0,654
walmart_155,sumdex slr camera sling pack,mp3 accessories,sumdex,144952,39.99,0
walmart_261,xerox 108r00645 imaging unit for phaser 6300 and 6350 printer,printers,xerox,108r00645,244.84,1
walmart_25,hp ce278a black laserjet print cartridge,printers,hp,hp ce278a,69.84,576
walmart_483,micronet mde1000 1tb fantom g-force megadisk usb 2.0 esata raid sub system,hard drives,micronet,mde1000,159.0,599
walmart_376,toshiba ph3100u-1e3s 1tb usb 3.0 desktop hard drive,hard drives,toshiba,ph3100u-1e3s,89.0,2
walmart_1564,incipio smart feather for apple ipad 2 light blue,electronics - general,incipio,ipad-227,33.25,397
walmart_23,avery shipping labels for color laser copier 3-3 4 x 4-3 4 matte white 100 pack,stationery & office machinery,avery,,16.67,847
walmart_417,da-lite da-plex standard rear projection screen - 60 x 80 video format,electronics - general,da-lite,27544,2931.99,847
walmart_1241,sharpie retractable permanent markers fine point set of 12 black,stationery & office machinery,sharpie,32701,13.64,847
walmart_1424,nzxt phantom crafted series atx full tower steel chassis black,electronics - general,nzxt,nzxt phantom,139.82,481
walmart_1532,da-lite high power model b manual screen with csr - 60 x 80 video format,electronics - general,da-lite,85319,369.99,847
walmart_978,sharpie permanent markers fine point - black - 12 count,stationery & office machinery,sharpie,30001wm,8.24,847
walmart_576,da-lite da-glas deluxe rear projection screen - 50 x 50 av format,electronics - general,da-lite,27647,1919.99,847
walmart_99,canon powershot a3300 is black 16.0 mp digital camera with 5x optical zoom 3.0 lcd 720p video w 50 bonus prints,digital cameras,canon,5035b001aa,156.54,686
walmart_1136,elite screens cinegray prime vision series fixed frame screen - 135 diagonal,electronics - general,elite screens,pvr135h1,1069.0,308
walmart_753,amzer anti-glare screen protector for ipad 2,mp3 accessories,amzer,90786,13.88,847
walmart_2251,elite m85xws1 screens manual pull down projection screen,electronics - general,elite screens,m85xws1,60.84,847
walmart_700,da-lite da-plex deluxe rear projection screen - 50 1 2 x 67 1 4 video format,electronics - general,da-lite,27562,2544.99,847
walmart_284,netgear powerline av 500 adapter,networking,netgear,xav5001100nas,79.82,3
walmart_725,c-line top-load poly sheet protectors heavy gauge letter 200ct,stationery & office machinery,,62097,28.94,382
walmart_2475,asus radeon hd5570 1gb ddr5 pci express graphics card,electronics - general,asus,eah5770 cucore/g/2di,180.41,847
walmart_1605,da-lite da-plex deluxe rear projection screen - 36 x 48 video format,electronics - general,da-lite,27559,1630.99,847
walmart_887,da-lite dual vision tensioned advantage deluxe electrol - hdtv format 92 diagonal,electronics - general,da-lite,88285,4242.99,567
walmart_967,da-lite da-glas unframed rear projection screen - 43 1 4 x 57 3 4 video format,electronics - general,da-lite,27602,920.99,847
walmart_1070,chicago cubs pink iphone 4 hard case,electronics - general,tribeca,fva4424,29.99,454
walmart_1178,da-lite da-glas deluxe rear projection screen - 96 x 96 av format,electronics - general,da-lite,27651,6128.99,571
walmart_2363,da-lite high power designer contour manual screen with csr - 50 x 67 video format,electronics - general,da-lite,92290,512.99,847
walmart_1531,hon 10700 series right pedestal credenza 72w x 24d x 29-1 2h mahogany,furniture,hon,10707rnn,799.0,847
walmart_462,da-lite video spectra 1.5 model c with csr manual screen - 69 x 92 video format,electronics - general,da-lite,82978,657.99,847
walmart_1979,iomega 1tb ego desktop usb 2.0 portable hard drive - midnight blue,hard drives,iomega,34837,89.98,847
walmart_934,evga geforce 210 512mb ddr3 pci express graphics card,electronics - general,evga,512p31310lr,32.88,25
walmart_2525,genius agama m-300 retractable mini mouse - optical - usb - black,mice,genius,31010615100,10.0,847
walmart_1952,pc treasures clickit classic mouse black,mice,pc treasures,07667,16.8,355
walmart_561,da-lite da-plex self trimming rear projection screen - 96 x 120 av format,electronics - general,da-lite,27903,7799.99,188
walmart_2253,visontek wireless candyboard mini keyboard with touchpad,electronics - general,visiontek,900319,59.82,13
walmart_6,hp c6020b coated paper 1 roll 36-inches x 150 ft,stationery & office machinery,hp,c6020b,49.88,697
walmart_1443,belkin basic wireless n150 usb adapter,networking,belkin,f7d1101,29.99,847
walmart_2224,da-lite video spectra 1.5 deluxe model b manual screen - 50 x 67 video format,electronics - general,da-lite,73639,181.99,653
walmart_2090,visiontek 900252 radeon hd 4650 1 gb 128-bit gddr2 pci express 2.0 graphics card .,electronics - general,visiontek,900252,86.92,847
walmart_2133,hp c7971a lto ultrium 1 tape cartridge,mp3 accessories,hp,c7971a,39.88,292
walmart_2115,da-lite high power model b manual screen with csr - 84 x 84 av format,electronics - general,da-lite,85303,372.99,847
walmart_1513,snapshield p2 polycarbonate case ipad 2 smoke,mp3 accessories,scosche,ipd2pcbk,20.88,224
walmart_1363,panasonic slimz over-ear headphone black pink rp-hx40-pk,electronics - general,panasonic,rp-hx40-pk,34.88,847
walmart_444,draper high contrast grey luma 2 manual screen - 60 x 60 av format,electronics - general,draper,206059,349.88,847
walmart_2546,da-lite da-tex rear tensioned advantage electrol - av format 8 x 8 diagonal,electronics - general,da-lite,85375,2549.38,847
walmart_2430,da-lite da-plex thru-the-wall rear projection screen - 81 x 108 video format,electronics - general,da-lite,23096,10048.99,847
walmart_2305,clickfree c2 500gb usb 3.0 portable external hard drive,hard drives,clickfree,hd527b3,84.98,31
walmart_1816,lexmark e450h11a toner 11000 page-yield black,printers,lexmark,e450h11a,248.27,847
walmart_1689,smead acid-free poly folder 2 fasteners 1 3 cut top tab letter manila 24 box,stationery & office machinery,,10545,42.94,847
walmart_673,xfx amd radeon hd 6950 1gb ddr5 graphics card,electronics - general,xfx,hd695xzndc,269.82,847
walmart_1192,trendnet 24-port 10 100 1000 mbps switch,networking,trendnet,tegs24g,239.99,847
walmart_2433,guardian air step antifatigue polypropylene mat 36 x 60 black,home care,guardian,24030502,50.97,847
walmart_1069,static cling screen protector kit for apple ipad 2,electronics - general,writeright,9227801,0.0,847
walmart_1761,buffalo technology linkstation duo 1 tb 2 x 500 gb network attached storage ls-wx1 .0 tl r1,networking,buffalo technology,lswx10tlr1,192.63,455
walmart_2210,crown tire-track scraper needlepunch polypropylene vinyl mat 48 x 72 anthracite,rugs,crown,te0046ac,124.97,274
walmart_1454,lexmark x644a11a black toner print cartridge,stationery & office machinery,lexmark,x644a11a,326.24,59
walmart_1205,microsoft publisher 2010,software,microsoft,164-06233,117.54,847
walmart_1792,cyber acoustics computer stereo silver headset microphone,electronics - general,cyber acoustics,ac401,14.84,620
walmart_144,case logic 16 value laptop briefcase black,computers,case logic,vnci116black,22.0,347
walmart_1162,quartet prestige bulletin board graphite-blend cork,stationery & office machinery,quartet,b243g,50.0,847
walmart_852,da-lite da-view thru-the-wall rear projection screen - 60 x 80 video format,electronics - general,da-lite,23046,13997.99,847
walmart_215,buffalo technology ministation metro 1 tb usb 2.0 portable external hard drive with integrated flex cable encryption and turbopc hd-pxt1tu2 b black,hard drives,buffalo technology,hdpxt1tu2b,99.82,106
walmart_693,canon mp41dhii printing calculator,stationery & office machinery,canon,mp41dhii,70.88,232
walmart_1963,human toolz 3-in-1 netbook pad galaxy black champagne,electronics - general,human toolz,3n1mgc,9.88,473
walmart_2549,3m dry-erase board porcelain 6 x4 aluminum frame,stationery & office machinery,3m,,579.29,847
walmart_2487,iluv micro-sizeusb car charger,phone accessories,iluv,iad215blk,9.88,847
walmart_2472,da-lite da-glas self trimming rear projection screen - 96 x 120 av format,electronics - general,da-lite,27915,7443.99,847
walmart_2018,wintec filemate 4gb compactflash memory card,usb drives,wintec,3fmcf4gb-r,15.98,270
walmart_278,da-lite hc cinema vision tensioned advantage electrol - av format 8 x 8 diagonal,electronics - general,da-lite,89939,2595.0,847
walmart_2082,da-lite cherry veneer model b manual screen with matte white fabric - 60 x 60 diagonal video format,electronics - general,da-lite,73179,167.99,847
walmart_2548,sabrent 6-in-1 usb 2.0 flash memory card reader,usb drives,sabrent,crw-ext,10.98,222
walmart_896,samsung s2 640gb usb 3.0 portable external hard drive red,hard drives,samsung,hx-mta64da / g42,78.88,847
walmart_2089,netgear prosafe gs716t 16-port ethernet switch,networking,netgear,gs716t-200nas,238.0,803
walmart_65,epson t020201 color ink cartridge,printers,epson,t020201,27.0,314
walmart_2088,targus red tg-6660tr tripod with 3-way panhead,photography - general,targus,tg-6660tr,29.98,4
walmart_16,xfx radeon hd6850 pcie 1gb ddr5 graphics card,electronics - general,xfx,hd685xzndc,195.0,847
walmart_920,xantech sllc1 speaker level to line converter,stereos/audio,xantech,sllc1,40.88,5
walmart_742,logitech m305 wireless mouse black,mice,logitech,910-001752,29.73,656
walmart_678,ilive app-enhanced boom box with ipod iphone dock,electronics - general,ilive,ibp391b,63.88,6
walmart_497,hon 310 series full-suspension file,storage,hon,315cpp,549.0,847
walmart_547,verbatim 96438 2gb store n go usb 2.0 flash drive,usb drives,verbatim,96438,14.84,379
walmart_1269,comprehensive 1 4 standard stereo phone jack cable end set of 25,tv accessories,comprehensive,spj-s,35.75,847
walmart_8,brother dk2113 ql label printers continuous length tape,stationery & office machinery,brother,dk2113,64.88,847
walmart_195,vtech ds6151 2-line expandable cordless phone with digital answering system caller id,electronics - general,vtech,ds6151,62.51,847
walmart_672,iosafe rugged 250gb usb 3.0 portable external hard drive,hard drives,iosafe,pa50250u5yr,249.99,847
walmart_1934,seagate blackarmor nas 440 is a 4tb network attached storage server,networking,seagate,,599.0,588
walmart_81,innovera heavyweight photo paper matte 8-1 2 x 11 50 sheets pack,stationery & office machinery,innovera,99650,11.7,296
walmart_312,vantec 2 1 sata 6g and pata pci-e combo host card w raid,electronics - general,vantec,ugt-is602r,40.33,402
walmart_2471,da-lite da-plex thru-the-wall rear projection screen - 78 x 139 hdtv format,electronics - general,da-lite,23077,11385.99,707
walmart_2229,kodak easyshare c1550 purple 16mp digital camera bundle w 5x optical zoom 3.0 lcd display w 50 bonus prints,digital cameras,kodak,c1550 prpl bndl,89.0,60
walmart_1206,bic triumph 537rt retractable gel pen 0.7 mm blue 1-dozen,stationery & office machinery,bic,rtr5711-blu,16.99,847
walmart_1530,wausau paper astrobrights colored paper 24lb 8-1 2 x 11 planetary purple 500 sheets ream,stationery & office machinery,wausau paper,22621,10.27,847
walmart_1825,philips 6-outlet 3 surge protector,electronics - general,philips,spp3160c/17,0.0,847
walmart_2431,da-lite silver matte model c manual screen - 7 x 9 av format,electronics - general,da-lite,90545,454.5,847
walmart_67,microsoft vx-5000 lifecam webcam red,electronics - general,microsoft,rka00014,27.82,847
walmart_1067,da-lite pearlescent tensioned advantage electrol - av format 6 x 8 diagonal,electronics - general,da-lite,84381,2532.99,847
walmart_1850,innovera 7653 compatible ink 8000 page-yield red,printers,innovera,7653,54.1,88
walmart_1217,verbatim smartdisk acclaim 320gb usb portable hard drive blue,hard drives,verbatim,ver97185,59.84,7
walmart_41,kingston ktd-dm8400a 1g 1gb ddr2 sdram memory module,memory,kingston,ktd-dm8400a / 1g,22.92,623
walmart_305,v7 10 cat5e snagless network patch cable blue,electronics - general,v7,v7n3c5e-10f-blus,4.88,847
walmart_2230,d-link dgs-1008p 8-port gigabit ethernet poe switch,networking,d-link,dgs1008p,179.99,8
walmart_2166,chicago bears pro grip mouse,mice,team pro mark,msnf06,26.99,847
walmart_1699,pendaflex cutless watershed file folders 1 3 cut top tab letter manila 100 per box,stationery & office machinery,,48434,22.69,816
walmart_255,iogear miniview extreme multimedia kvm and peripheral sharing switch,networking,iogear,gcs1734,85.0,847
walmart_1090,serif webplus essentials,software,serif,wpeusdvdrt,44.82,114
walmart_1342,v7 3 cat6 snagless molded network patch cable black,electronics - general,v7,v7n2c6-03f-blks,4.88,847
walmart_1465,kodak easyshare c195 red 14.0 mp digital camera w bonus case bundle 5x optical zoom 3.0 lcd smart capture w 50 bonus prints,digital cameras,kodak,c195 red bndle,79.0,847
walmart_719,hp q6511a hp 11a toner 6000 page-yield black,printers,hp,q6511a,191.03,9
walmart_679,cyberpower 900 joules 6-outlet surge protector,electronics - general,cyberpower,615,13.88,847
walmart_582,ihome wireless optical mouse black,mice,ihome,ih-m821wb,25.56,847
walmart_2504,da-lite da-glas deluxe rear projection screen - 40 1 4 x 53 3 4 video format,electronics - general,da-lite,27655,1752.99,847
walmart_2220,da-lite da-plex deluxe rear projection screen - 58 x 104 hdtv format,electronics - general,da-lite,27571,4629.99,847
walmart_324,corsair xms2 2gb 2 x 1gb pc2-6400 800mhz 240-pin ddr2 cl5 dual channel desktop memory kit - twin2x4096-6400c5c,memory,corsair,twin2x4096-6400c5c,72.82,159
walmart_528,wintec filemate 4gb swivel usb flash drive black,usb drives,wintec,3fmusb4gwb-r,7.84,237
walmart_56,edge tech proshot 4gb sdhc class 6 memory card,usb drives,edge tech,pe209780,10.88,103
walmart_2260,panasonic kx-tga6645b dect 6.0 plus expandable digital cordless answering system with 5 handsets,electronics - general,panasonic,kx-tg6645b,150.0,593
walmart_2515,corsair 115gb solid state drive corsair force series,hard drives,corsair,cssdf115gbp2brk,261.25,10
walmart_1701,smead folders front interior pocket straight end tab letter manila 50 box,stationery & office machinery,,24117,45.94,243
walmart_1257,da-lite da-plex unframed rear projection screen - 84 x 84 av format,electronics - general,da-lite,27503,3561.99,847
walmart_2365,canon cli-226 black ink tank,printers,canon,4546b001,13.97,98
walmart_2361,da-lite da-glas standard rear projection screen - 50 x 50 av format,electronics - general,da-lite,27628,1631.99,847
walmart_2297,da-lite medium oak veneer model b manual screen with matte white fabric - 60 x 60 diagonal video format,electronics - general,da-lite,73171,167.99,134
walmart_378,maxell 631012 blu-ray disc 15 pk,mp3 accessories,maxell,631012,61.88,258
walmart_1535,mercury luggage executive computer backpack,handbags,mercury luggage,,56.99,11
walmart_565,victor 1570-6 desktop two-color printing calculator,stationery & office machinery,victor,15706,199.88,847
walmart_2349,brother tn110bk black toner cartridge,printers,brother,tn110bk,49.88,763
walmart_708,green onions supply iveil hybrid keyboard protector,electronics - general,green onions supply,rt-kbhb06,31.88,847
walmart_2517,logitech wireless mouse m315 victorian,mice,logitech,910002534,19.88,847
walmart_975,startech.com pex13943 4 port pcie 1394a firewire adapter card,electronics - general,startech,pex13943,34.88,806
walmart_615,tp-link network tl-sg1024d 24 port gigabit desktop switch,networking,global marketing,tl-sg1024d,116.0,846
walmart_1863,lexar media ljdff2gbasbna 2gb jumpdrive firefly usb 2.0 flash drive,usb drives,lexar media,ljdff2gbasbna,13.88,353
walmart_2020,da-lite da-plex deluxe rear projection screen - 96 x 96 av format,electronics - general,da-lite,27557,6426.99,847
walmart_889,logitech wireless mouse m310 bundle,computers,,,29.88,847
walmart_1688,universal pressboard classification folder legal box of 10 red,stationery & office machinery,,82007,47.84,847
walmart_1298,lenovo thinkpad x60 tablet digitizer pen tether 3pk,electronics - general,lenovo,41u4820,13.67,508
walmart_697,pentel ez 2 automatic pencil hb 0.70 mm 5 black and 5 blue barrels 10 pack,stationery & office machinery,pentel,ax17bp10k6,5.69,847
walmart_2149,kodak easyshare m552 dark pink 14mp digital camera w 5x optical zoom 2.7 lcd display w 50 bonus prints,digital cameras,kodak,m552pink,94.54,370
walmart_1242,gear head 2.4 ghz wireless optical nano mouse black,mice,gear head,mp2800blk,15.82,528
walmart_722,corsair memory vs2gbkit400c3 2 gb pc3200 400mhz 184-pin ddr desktop memory kit,memory,corsair,vs2gbkit400c3,59.82,233
walmart_2055,energizer 9v nimh 150mah rechargeable battery,electronics - general,energizer,nh22nbp,12.97,847
walmart_218,griffin technology outfit gloss ipod touch 4g black,mp3 accessories,griffin technology,gb01967,24.99,195
walmart_1809,da-lite da-mat tensioned advantage electrol - av format 8 x 10 diagonal,electronics - general,da-lite,84374,3077.99,847
walmart_1435,usrobotics 56k usb 2.0 external modem,networking,u.s. robotics,usr5637,47.82,847
walmart_818,incipio ipod touch 4g silicrylic hard shell case with silicone core all black,mp3 accessories,incipio,ip-904,28.5,422
walmart_2332,da-lite da-plex self trimming rear projection screen - 40 1 4 x 53 3 4 video format,electronics - general,da-lite,27580,1892.99,532
walmart_1570,hon 10500 series curved return,furniture,hon,105817rnn,479.0,847
walmart_1405,ibm 28p2010 black toner cartridge,printers,ibm,28p2010,425.0,307
walmart_1511,canon powershot elph 100 hs blue 12.1 mp digital camera with 4x optical zoom 3.0 lcd 1080p hd video w 50 bonus prints,digital cameras,canon,4925b001aa,178.54,603
walmart_1607,maxell couleur series ear buds purple,mp3 accessories,maxell,190238,16.18,12
walmart_737,lexmark t650a11a black toner print cartridge,printers,lexmark,t650a11a,202.87,116
walmart_1246,i-tec ipad anti-glare screen protector,mp3 accessories,i-tec electronics,t6020,17.88,338
walmart_208,maccase premium leather 17 macbook pro flight jacket w backpack option,electronics - general,maccase,155623,191.96,847
walmart_1432,blackberry skin for playbook tablet black,electronics - general,blackberry,acc-39316-301,19.88,847
walmart_1506,wilson jones super heavy weight sheet protector,stationery & office machinery,wilson jones,21402,10.94,407
walmart_2436,elite screens maxwhite vmax2 plus2 series ezelectric motorized screen - 135 diagonal in black case,electronics - general,elite screens,vmax135uwv2,649.99,847
walmart_2116,case logic 12.1 laptop sleeve,electronics - general,case logic,147731,19.99,847
walmart_794,pc treasures retractable mighty mini mouse navy,mice,pc treasures,07221,9.88,847
walmart_280,da-lite da-tex rear tensioned advantage electrol - hdtv format 184 diagonal,electronics - general,da-lite,35199,4612.99,847
walmart_2216,lexmark 1382920 toner 3000 page-yield black,stationery & office machinery,lexmark,1382920,270.9,556
walmart_932,da-lite dual vision tensioned cosmopolitan electrol - av format 10 x 10 diagonal,electronics - general,da-lite,84992,2735.99,724
walmart_219,microsoft wireless mobile mouse 4000 sgkomen pink,mice,microsoft,d5d-00052,20.0,478
walmart_397,iomega 2tb ego desktop usb 2.0 portable hard drive - midnight blue,hard drives,iomega,34822,122.98,847
walmart_2461,filemate imagine series k2010 usb standard keyboard,computers,,,15.12,421
walmart_2237,verbatim 4.7 gb 16x dvd-r whilte inkjet printable 50 packs spindle disc,mp3 accessories,verbatim,95079,16.14,169
walmart_248,razer lachesis gaming mouse,mice,razer,rz01-00170500-r3u1,77.5,847
walmart_29,vantec nexstar mx dual 3.5 sata hard drive enclosure,electronics - general,vantec,nst-400mx-s2,49.71,198
walmart_739,read right pathkleen printer roller cleaner sheets 8 1 2 10pk,printers,read right,rr1237,9.84,14
walmart_1349,night owl security products ccd wired color security camera with 60 cable,garden - general,night owl,cam-s420-245a,67.82,15
walmart_382,casio exilim ex-zs5 14.1 mp digital camera silver w 5x optical zoom 2.7 lcd display,digital cameras,casio,,100.0,714
walmart_1016,sharpie retractable permanent markers fine point assorted 3pk,stationery & office machinery,sharpie,32726pp,8.18,847
walmart_2484,sylvania 4gb touch video mp3 player black,mp3,sylvania,smpk4230-black,35.0,847
walmart_2424,philips 3 high speed hdmi cable,electronics - general,philips,swv3431w/17,10.43,847
walmart_1169,v7 25 cat6 snagless molded network patch cable green,electronics - general,v7,v7n2c6-25f-grns,9.76,847
walmart_1796,cables unlimited - 3.5 mm 50 male to female stereo cable,electronics - general,cables unlimited,aud-1000-50,9.88,847
walmart_2160,nikon d3000 black 10.2 mp dslr camera kit with af-s dx nikkor 18-55mm f 3.5-5 .6 g vr lens w 50 bonus prints,digital cameras,nikon,d3000 kit,443.99,16
walmart_918,coby 7 lcd dual screen tablet portable dvd player,dvd players,coby,tfdvd7752,139.29,847
walmart_878,siig wireless multimedia keyboard mouse,electronics - general,siig,jk-wr0212-s1,29.82,847
walmart_2323,quartet prestige bulletin board graphite-blend cork maple frame,stationery & office machinery,quartet,b243ma,50.0,847
walmart_2091,scosche fptm mirrored screen protector kit for ipod touch 4g 2pk,mp3 accessories,scosche,fptm,21.88,847
walmart_621,zotac geforce gt430 1gb ddr3 pci-express 2.0 graphics card,electronics - general,zotac,zt-40604-10l,88.88,847
walmart_137,night owl optics apollo-45 4-channel h. 264 500gb dvr kit,garden - general,night owl,apollo-45,338.0,809
walmart_1060,da-lite da-plex self trimming rear projection screen - 58 x 104 hdtv format,electronics - general,da-lite,27590,4635.99,847
walmart_1191,siig 1m mini displayport to display port adapter cable,electronics - general,siig,cb-dp0d11-s1,12.88,847
walmart_2457,crown industrial deck plate antifatigue vinyl mat 36 x 144 black yellow border,home care,crown,,379.97,847
walmart_2069,kodak 10c color ink cartridge,printers,kodak,10c,19.97,310
walmart_671,wisconsin badgers iphone 4 case black shell,electronics - general,tribeca,fva3175,29.99,847
walmart_1145,kodak easyshare m531 red 14mp digital camera w 3x optical zoom 2.7 lcd display w 50 bonus prints,digital cameras,kodak,m531 red,89.0,380
walmart_1296,da-lite da-glas unframed rear projection screen - 57 3 4 x 77 video format,electronics - general,da-lite,27604,1609.99,847
walmart_2283,plantronics h91cis encore h91 headset,electronics - general,plantronics,h91cis,119.88,847
walmart_509,panasonic lumix dmc-fh5v 16.1 mp violet digital camera w 4x optical zoom 2.7 lcd display,digital cameras,panasonic,panasonic dmc-fh5v,129.0,847
walmart_1382,case logic trend compact camera case,mp3 accessories,case logic,214336,15.19,847
walmart_2293,canon powershot sx130-is black 12.1 mp digital camera w 12x optical zoom 3.0 lcd display w 50 bonus prints,digital cameras,canon,sx130,191.99,563
walmart_456,dreamgear charge and sync cable for ipod iphone ipad purple,mp3 accessories,dreamgear,isound-1634,19.88,847
walmart_1657,guardian flexstep antifatigue polypropylene rubber mat 24 x 36 black,home care,guardian,24020300,36.97,17
walmart_2405,hp laserjet 53x black print cartridge,printers,hp,q7553x,164.84,186
walmart_618,lost 4gb flashback surfdrive usb flash drive,usb drives,ep memory,lost-surfflb/4g,10.84,847
walmart_2508,sanus powerbridge in wall power and cable management,electronics - general,sanus,,84.99,18
walmart_2351,targus mobile elite 15.4 notebook case,computers,targus,146440,51.99,847
walmart_2193,plustek bookreader v100 - b66-bbe21-a,computers,plustek,b66-bbe21-a,539.88,19
walmart_944,brother tn360 black toner cartridge,printers,brother,tn360,45.54,821
walmart_747,encore hoyle card games 2011 casual gaming,software,encore,21331,19.99,847
walmart_2201,pny 4gb micro swivel attache flash drive,printers,pny,,9.84,601
walmart_790,lenovo gray 15.6 ideapad y560-064654yu laptop pc with intel core i7-740qm processor windows 7 home premium,laptop computers,lenovo,064654u,998.0,847
walmart_399,motorola h17 bluetooth headset,electronics - general,motorola,89334m,38.84,47
walmart_320,st. louis cardinals ipod touch 4g hard case,electronics - general,tribeca,fva4549,29.99,847
walmart_348,ep 2gb usb 2.0 capless wave flash drive pink,usb drives,ep memory,epclp/2gb -2.0,8.84,847
walmart_1271,verbatim 4.7 gb 16x dvd-r lightscribe 1.2 30 packs cake box disc,mp3 accessories,verbatim,95339,19.72,847
walmart_1316,case logic 208 capacity nylon cd dvd wallet,electronics - general,case logic,87974,19.99,168
walmart_149,imation 43347 dds-2 data cartridge,mp3 accessories,imation,43347,10.88,847
walmart_1712,black n red casebound notebook ruled white 96 sheets pad,stationery & office machinery,,d66174,8.27,847
walmart_315,pny 8gb micro slide attache usb flash drive - silver,usb drives,pny,p-fdu8gbsl-ef / sil,14.84,492
walmart_1367,razer lycosa gaming keyboard,electronics - general,razer,lycosa,67.84,377
walmart_1984,gear head dual laptop cooling fan cf3000u,electronics - general,gear head,cf3000u,15.0,130
walmart_32,da-lite da-mat deluxe fast fold complete front projection screen - 68 x 68,electronics - general,da-lite,88604,829.99,847
walmart_1211,zax pro series component cable 3m,tv accessories,zax,87203,11.88,847
walmart_1284,v7 25 cat6 snagless molded network patch cable red,electronics - general,v7,v7n2c6-25f-reds,9.76,847
