id,title,category,brand,modelno,price,cluster_id
walmart_1805,sandisk 16gb sdhc memory card,usb drives,sandisk,sdsdb016gaw11,34.54,847
walmart_908,hp c6567b coated paper 1 roll 42-inches x 150 ft,stationery & office machinery,hp,c6567b,69.88,778
walmart_776,goodhope bags computer sleeve plus,electronics - general,goodhope bags,4110,23.99,847
walmart_1726,guardian ecoguard indoor rubber wiper mats 24 x 36 charcoal,rugs,guardian,eg020304,23.97,633
walmart_2478,mace security easy watch hidden camera in pir motion detector housing,garden - general,mace security,ewc-pir-rj11,119.82,196
walmart_330,scosche increased dynamic range chameleon earphones idr355md,mp3 accessories,scosche,idr355md,24.34,614
walmart_54,canon imageformula dr-2010c compact color scanner,electronics - general,canon,dr-2010c,479.98,199
walmart_2537,corsair flash voyager 32gb usb 3.0 flash drive,usb drives,corsair,cmfvy3-32gb,74.88,847
walmart_1624,hp q3675a image transfer kit,printers,hp,q3675a,194.84,682
walmart_1300,advantus grip-a-strip display rail 96 high aluminum finish,stationery & office machinery,,2015,41.99,847
walmart_2527,verbatim 100-pack 16x datalifeplus shiny silver dvd-r spindle,mp3 accessories,verbatim,97017,29.98,798
walmart_1632,case logic high zoom camera case,mp3 accessories,case logic,152256,17.59,737
walmart_635,nikon coolpix p500 12.1 mp black digital camera 4-144mm zoom nikkor lens 3 lcd display hd video w 50 bonus prints,digital cameras,nikon,26256,389.44,200
walmart_2023,minnesota vikings camera case,electronics - general,tribeca,fva3052,19.99,847
walmart_1527,bic great erase grip chisel dry erase marker black 12pk,stationery & office machinery,bic,gdem11-blk,16.08,847
walmart_1198,iomega 34337 home media network hard drive - 1tb - rj-45 network usb,hard drives,iomega,34337,129.98,847
walmart_2078,dymo d1 standard tape cartridge for dymo label makers 1 4in x 23ft black on clear,stationery & office machinery,dymo,43610,17.27,201
walmart_1457,avery metal rim key tags card stock metal 1-1 4 diameter 50 pack,accessories apparel,avery,,7.42,202
walmart_2043,philips 6 hdmi ethernet cable,tv accessories,philips,swv3481s/17,27.0,847
walmart_292,case logic universal mp3 sport case - medium,mp3 accessories,case logic,120579,11.99,847
walmart_1402,adesso gp-160pb easy cat 2 button glidepoint touchpad - electrostatic - ps 2,mice,adesso,gp-160pb,34.82,203
walmart_1537,hp 8gb v220w usb flash drive,usb drives,pny,p-fd8gbhp220-ef,14.84,847
walmart_1031,sony 39 lightweight camera and camcorder tripod vct-r100,camera and camcorder accessories,sony,vctr100,24.54,406
walmart_2061,brenthaven prolite iii shoulder case black,electronics - general,brenthaven,114717,79.99,271
walmart_851,avery index maker clear label unpunched dividers with white tabs,stationery & office machinery,avery,11442,77.18,847
walmart_2492,scosche 4 speaker adapter,car stereos,scosche,sa41069,29.88,847
walmart_2469,hon 500 series two-drawer lateral file black,stationery & office machinery,hon,572lp,359.94,847
walmart_2266,lyoto machida mouse pad,mice,wincraft,86210010,16.99,204
walmart_1223,siig 3.5 sata superspeed usb 3.0 hard drive enclosure pro,electronics - general,siig,ju-sa0b12-s1,41.39,847
walmart_290,semi hard case set for ipad 2 white,mp3 accessories,simplism,tr-shcsipd2-wt / en,29.99,847
walmart_1779,elite screens cinewhite cinetension2 series 64 overall height tension electric motorized screen - 84 diagonal,electronics - general,elite screens,te84vw2,637.0,847
walmart_394,dymo by pelouze heavy-duty electronic utility scale,stationery & office machinery,,4010,136.94,847
walmart_249,solidtek keyboard with touch pad black,electronics - general,solidtek,kb7070bu,59.99,847
walmart_496,case logic universal pocket - camouflage,mp3 accessories,case logic,122245,9.59,205
walmart_2331,visual land v-motion pro 4gb mp3 player,mp3,visual land,me9644gbblk,39.88,815
walmart_1419,innovera softskin gel keyboard wrist rest black,electronics - general,innovera,51451,11.88,847
walmart_968,vivitar 54 tripod,camera and camcorder accessories,vivitar,viv-vpt-4654,25.0,847
walmart_2186,sabrent sbt-cps2 usb to dual ps 2 converter cable,electronics - general,sabrent,sbt-cps2,4.88,753
walmart_744,da-lite matte white scenic roller manual screen - 30 x 30,electronics - general,da-lite,40353,4077.99,847
walmart_1887,philips vibe 4gb mp3 video player,mp3,philips,sa2vbe04kc/17,39.98,847
walmart_2540,zyxel homeplug av 200mbps powerline wall plug adapter,networking,zyxel,pla401v3,47.92,209
walmart_741,simplism shoulder case for ipad red,mp3 accessories,simplism,trlcslipaddren,58.76,210
walmart_1834,guardian ecoguard indoor rubber wiper mats 36 x 60 charcoal,rugs,guardian,eg030504,55.97,773
walmart_2531,night owl security products wired color security camera with 60 of cable,garden - general,night owl,cam-cm01-245,49.71,365
walmart_1908,middle atlantic designer inspired ultra quiet fan panel,tv accessories,middle atlantic,uqfp-4dra,525.0,212
walmart_319,toshiba dvr670 dvd vhs recorder with built-in tuner,dvd players,toshiba,dvr670,214.0,836
walmart_34,hp 45 black inkjet cartridge 51645a,printers,hp,51645a,35.78,439
walmart_2483,kenwood 6.5 2-way 160w speaker system kfc-1652,stereos/audio,kenwood,kfc-1652,29.99,451
walmart_374,avery mailing seals 200ct white,stationery & office machinery,avery,06740,0.0,847
walmart_2324,motorola netopia 3346n-ent broadband router,networking,motorola,3346n-ent,103.84,214
walmart_862,nokia travel charger,phone accessories,nokia,279044,20.53,470
walmart_1674,storex portable file storage box w organizer lid black,storage,,61510u01c,25.0,847
walmart_106,inland lightweight headphones with volume control,electronics - general,inland,87010,7.82,847
walmart_1393,gbc design view presentation binding system covers clear 8-3 4,stationery & office machinery,,2514500,19.94,847
walmart_1437,plantronics usb-to-headset adapter,electronics - general,plantronics,da-40,27.98,368
walmart_2295,lexmark 18c2249 36xl 37xl high-yield ink 500 page-yield 2 pack black,printers,lexmark,18c2249,66.99,348
walmart_1956,post-it super sticky color-coding labels 2700-w,stationery & office machinery,post-it,2700-w,10.48,847
walmart_1062,da-lite matte white advantage manual with csr - wide format 130 diagonal,electronics - general,da-lite,34718,1060.99,847
walmart_447,ematic articulating wall mount kit for 15 tv includes 6ft hdmi cable cleaning solution cleaning cloth emw3202,tv accessories,ematic,emw3202,29.99,736
walmart_1200,verbatim 95003 3x dvd-ram double-sided media,mp3 accessories,verbatim,95003,13.88,216
walmart_911,jaton geforce 6200 256mb video card,computers,jaton,video-338pci-lp,97.82,847
walmart_229,wacom ptk640 intuos4 medium pen graphics tablet,electronics - general,wacom tech corp.,ptk640,372.88,733
walmart_1237,hp q2429a maintenance kit,printers,hp,q2429a,234.54,699
walmart_1184,human toolz 3-in-1 laptop pad galaxy red,electronics - general,human toolz,3n1ngr,9.88,847
walmart_973,lexmark 16 black print cartridge 10n0016,printers,lexmark,10n0016,28.0,433
walmart_938,viewsonic pro8500 dlp projector,electronics - general,viewsonic,pro8500,1518.0,400
walmart_1589,startech esata usb to sata external hard drive docking station for 2.5 hdd,electronics - general,startech,satadocku2e,29.84,712
walmart_2049,adobe creative suite v. 5.0 design premium upgrade version windows,software,adobe,65065612,578.54,847
walmart_641,elite electric100h screens spectrum electrol projection screen,electronics - general,elite screens,electric100h,160.0,847
walmart_804,belkin grip ergo for ipod,mp3 accessories,belkin,f8z524tt064,10.54,847
walmart_1453,sharpie stainless steel permanent marker fine tip black,stationery & office machinery,sharpie,1747388,7.94,847
walmart_513,cables unlimited 2 port e-sata controller pci express card,electronics - general,cables unlimited,ioc-7707,49.88,847
walmart_37,roocase multi-angle folio leather case stylus for acer iconia tab a500,electronics - general,roocase,222043,47.99,847
walmart_360,scosche fptag anti-glare screen protectors for ipod touch 2pk,mp3 accessories,scosche,fptag,16.88,612
walmart_2248,arrowmounts cantilever retractable wall mount for flat panel tvs up to 27,tv accessories,arrowmounts,am-p16b,39.99,357
walmart_1842,inland pro usb keyboard and mouse combo set black,electronics - general,inland,70126,12.0,847
walmart_1323,verbatim 500gb clln usb portable hard drive 97060,hard drives,verbatim,97060,77.84,847
walmart_69,lorex simulated bullet style surveillance camera,garden - general,lorex,sg-610,12.84,220
walmart_1577,foldio p2 leather texture folio case for ipad 2 black,mp3 accessories,scosche,ipd2flbk,44.88,437
walmart_1030,canon x25 toner cartridge 8489a001aa,printers,canon,8489a001aa,79.53,221
walmart_2048,da-lite matte white deluxe model b manual screen - 60 x 60 av format,electronics - general,da-lite,40223,118.99,847
walmart_124,ifrogz earpollution cs40-orange marin,mp3 accessories,ifrogz,epcs40orgmrn,39.99,847
walmart_2296,kanguru defender 1gb v2 kdv2-1g usb 2.0 flash drive,usb drives,kanguru,kdv2-1g,39.82,785
walmart_2503,siig 1-port serial pc card,electronics - general,siig,jj-pcm012-s3,59.99,223
walmart_774,ifrogz pulse case for ipod touch 4 iron and white,electronics - general,ifrogz,it4plsirnwht,29.99,847
walmart_2345,fellowes gel wrist rest graphite,electronics - general,fellowes,91737,12.84,225
walmart_2437,cooler master cooler master notepal x-lite black,electronics - general,coolermaster,r9-nbc-xlit-gp,24.88,847
walmart_1011,startech superspeed usb 3.0 sata adapter cable for 2.5 in or 3.5 in hard drives usb3s2sata,networking,startech,usb3s2sata,49.0,739
walmart_258,motorola ear-piece with boom microphone,phones,motorola,56320,14.88,226
walmart_120,jvc kd-r320 cd receiver,car stereos,jvc,kdr320,70.0,609
walmart_807,logitech 910-000872 mx anywhere mouse,mice,logitech,910-000872,59.82,847
walmart_1468,boss audio bv9958b - single-din in-dash dvd mp3 cd am fm receiver with full detachable 7 widescreen touchscreen tft monitor usb and sd memory card ports and front panel aux input,car stereos,boss,bv9958b,180.0,847
walmart_2130,ematic 4gb video mp3 player with 2.4 lcd built in 5mp digital camera assorted colors,mp3,ematic,em504camb,39.88,847
walmart_1966,cables unlimited 15 usb 2.0 a to b cable clear,electronics - general,cables unlimited,usb-5010-05m,8.88,229
walmart_1286,mayline brighton series suspended box file pedestal cherry,storage,mayline,btbf20lcr,229.0,799
walmart_1430,ten one design pogo stylus for iphone 4 burnt orange,mp3 accessories,ten one design,t1-af25-407,13.49,847
walmart_617,clarion cz101 single cd mp3 wma aac receiver,car stereos,clarion,cz101,89.99,230
walmart_1245,protector film for ipad 2 anti-glare,mp3 accessories,simplism,tr-pfipd2-ag / en,14.99,847
walmart_1021,samsill altego 15 neoprene laptop sleeve platinum,electronics - general,samsill,36031samsill,34.99,847
walmart_2143,link depot 14 ethernet enhanced cat6 networking cable blue,networking,link depot,c6m-14-bub,3.98,847
walmart_2522,v7 m30p20-7n standard ps 2 optical mouse,mice,v7,m30p20-7n,6.84,231
walmart_2046,x-acto prox electric pencil sharpener silver,stationery & office machinery,x-acto,1612,59.97,847
walmart_2039,startech.com pm1115u fast ethernet print server,networking,startech,pm1115u,40.84,235
walmart_1870,kensington pro fit mobile wireless mouse with nano receiver black k72366us,mice,kensington,,23.88,847
walmart_2236,roocase executive portfolio leather case w 2 screen protector for blackberry playbook,electronics - general,roocase,220761,35.99,580
walmart_1489,quartet contour fabric bulletin board,stationery & office machinery,quartet,7693m,73.24,236
walmart_1028,adobe software photoshop premiere element bd version 8,software,adobe,65045677,149.99,847
walmart_2008,roocase 2 in 1 capacitive stylus ballpoint pen for ipad 2 tablet,electronics - general,roocase,219943,15.99,847
walmart_630,lexar 32gb twistturn jumpdrive,usb drives,lexar media,ljdtt32gasbna,61.8,831
walmart_782,swingline optima powerease stapler graphite,stationery & office machinery,swingline,87850,23.94,847
walmart_954,adesso pro mechanical gaming keyboard,electronics - general,adesso,mkb-135b,74.88,847
walmart_658,keyspan usb twin serial adapter,electronics - general,keyspan,usa-28xg,70.73,765
walmart_1017,scotch cushion wrap,stationery & office machinery,scotch,7990-c24,20.35,847
walmart_916,iogear smartlink usb 2.0 adapter,networking,iogear,gun262wv,16.23,239
walmart_2368,thermaltake tt esports challenger ultimate gaming keyboard,electronics - general,thermaltake,kb-chu003us,89.52,511
walmart_1372,dymo file folder labels 2-up,stationery & office machinery,dymo,30277,10.88,847
walmart_1338,smead 5 expansion end tab file pockets w tyvek straight letter manila 10 box,stationery & office machinery,,75174,37.94,488
walmart_652,startech 6 rj-45 to db9 cisco console management router cable,electronics - general,startech,db9concabl6,19.0,241
walmart_276,sony vgp-bkb1 bluetooth wireless keyboard,electronics - general,sony,vgpbkb1,97.15,427
walmart_2254,brother hl-4570cdw wireless laser color printer duplex printing,printers,brother,hl-4570cdw,481.86,554
walmart_2520,peerless smartmount universal flat mount 32 - 50 screens,tv accessories,peerless,sf650,64.99,847
walmart_1236,royal px70mx paper shredder,stationery & office machinery,royal consumer,29160j,69.99,242
walmart_2544,crown mat-a-dor entrance antifatigue rubber mat 24 x 32 black,home care,crown,masr42bk,55.97,847
walmart_620,premiertek flip leather case with stand for ipad 2,electronics - general,premiertek,lc-ipad2-std,46.88,847
walmart_2327,connectland 1.20-meter stainless steel notebook security lock with key,electronics - general,syba multimedia,cl-nbk65016,11.88,768
walmart_1510,cables unlimited ultrafast hardcore gaming hdmi cable,tv accessories,cables unlimited,gam-2295-06,18.57,847
walmart_405,case logic 11.6 hard shell netbook sleeve,electronics - general,case logic,154722,19.99,847
walmart_645,lexmark prospect pro205 wireless-n all-in-one printer scanner copier fax,printers,lexmark,lexmark pro205,128.54,295
walmart_2364,tops classified colors notebook narrow rule 5-1 2 x 8-1 2 orchid 100 sheets,stationery & office machinery,tops business forms,99712,11.58,245
walmart_2259,iogear 1gb mobile usb 2.0 scribe digital pen flash drive,usb drives,iogear,gpen300,74.88,246
walmart_706,kingston hyperx blu 2gb ddr2 desktop memory module,memory,kingston,khx6400d2b1/2g,34.72,847
walmart_861,chief manufacturing dual swing arm lcd wall mount,furniture,chief manufacturing,,143.2,820
walmart_2105,coby purple high-performance isolation stereo earphones cvem79pur,electronics - general,coby,cvem79pur,8.54,847
walmart_1324,kensington profit wired full size mouse,mice,kensington,k72343us,19.88,247
walmart_159,powermat wireless charging receiver for blackberry torch,phone accessories,powermat,prl01-001-us,23.88,249
walmart_2387,powermat wireless charging system for blackberry torch,phone accessories,powermat,pbl01-001-us,38.88,250
walmart_2152,d-link airpremier n dual band poe access point,networking,d-link,dap-2590,318.0,847
walmart_2195,memorex 4x rewritable dvd-rw - 5 pack slim jewel case,mp3 accessories,memorex,3202-5745,8.88,847
walmart_2103,iogear 2-port usb 2.0 printer auto sharing switch black,computers,iogear,gub211w6,22.92,570
walmart_2304,samsung 1gb ddr2 sdram desktop memory module,memory,samsung,mv-2s1g4 / us,22.88,847
walmart_1276,viewsonic value 19 lcd monitor va1932wm,monitors,viewsonic,va1932wm,149.0,847
walmart_203,sharpie pen retractable fine point pens black set of 2,stationery & office machinery,sharpie,,5.88,847
walmart_492,corsair builder series cx v2 500w 80 plus certified power supply,electronics - general,corsair,cmpsu-500cxv2,67.88,847
walmart_1553,elite electric120v screens spectrum electrol projection screen,electronics - general,elite screens,electric120v,189.0,847
walmart_365,mustang 70 x 70 manual screen in matte white,electronics - general,mustang,sc-m7011,86.6,847
walmart_310,logitech usb webcam c270h,electronics - general,logitech,c270h,29.0,254
walmart_36,iluv desktop alarm clock with bed shaker for your iphone ipod - pink,portable audio,iluv,imm153pnk,54.88,847
walmart_527,3m natural view screen protector for ipad,electronics - general,3m,98-0440-5155-9,45.88,255
walmart_1771,lexmark c9202 toner 14000 page-yield,printers,lexmark,c9202kh,288.86,441
walmart_616,rayovac alkaline aa batteries 4pk,electronics - general,rayovac,815-4tupcf,0.0,847
walmart_214,da-lite high contrast matte white model b manual screen - 60 x 60 av format,electronics - general,da-lite,93154,92.99,847
walmart_588,mionix naos 5000 laser gaming mouse,electronics - general,mionix,000mio5000m,89.96,426
walmart_810,startech.com icusb1284 6 ft usb to parallel printer adapter,printers,startech,icusb1284,15.88,259
walmart_122,pilot g2 retractable gel ink roller ball pen extra fine point 12-count,stationery & office machinery,pilot,31004,15.94,847
walmart_1751,maxell 630020 12x high-speed rewritable cd-rw - single,mp3 accessories,maxell,630020,1.98,260
walmart_1651,inland proht iphone screen protector,electronics - general,inland,08563,9.99,261
walmart_1926,inland proht film screen protector for ipad,mp3 accessories,inland,08562,14.99,847
walmart_21,iogear 2-port miniview micro usb plus kvm switch,networking,iogear,gcs632uw6,37.57,847
walmart_2146,cooler master notepal u2 black,electronics - general,coolermaster,r9-nbc-8pbk-gp,24.82,847
walmart_2450,hp q1426a universal high gloss photo paper,stationery & office machinery,hp,q1426a,93.24,847
walmart_644,case logic 17 rolling laptop case,electronics - general,case logic,vnr-217black,76.88,847
walmart_86,samsung 33-0525-05 samsung fasciante i500 oem multimedia dock,electronics - general,samsung,33-0525-05,29.88,264
walmart_1134,da-lite high power advantage manual with csr - hdtv format 133 diagonal,electronics - general,da-lite,85742,1267.99,415
walmart_809,belkin f3u138v03-rtc usb 2.0 retractable cable,electronics - general,belkin,f3u138v03-rtc,9.88,847
walmart_992,hp 61 black tri-color combo inkjet cartridge,printers,hp,hp 61,30.5,703
walmart_1835,eco-products flat compostable cold drink cup lids 1000ct,house wares,,epflcc,81.97,847
walmart_1112,kingston kvr800d2n5 1g valueram 1gb ddr2-800 240-pin sdram desktop memory module,memory,kingston,kvr800d2n5/1g,20.92,847
walmart_1176,redi-tag arrow message page flags in dispenser blue 120 flags,stationery & office machinery,,81034,5.15,847
walmart_1262,manfrotto unica v dslr messenger bag,photography - general,manfrotto,mb-sm390-5bc,89.99,356
walmart_802,memorex 52x write-once cd-r with lightscribe technology - 10 pack slim jewel case,mp3 accessories,memorex,,8.88,847
walmart_701,da-lite high contrast matte white advantage manual with csr - av format 6 x 8 diagonal,electronics - general,da-lite,92695,765.45,847
walmart_2250,sharpie 12pk super permanent markers black,stationery & office machinery,sharpie,33001,14.28,847
walmart_796,aluratek plug-less usb charging station,phone accessories,aluratek,aucs01f,19.99,847
walmart_2353,sony dpw30r2h 1.4 gb camcorder 8cm dvd rw,mp3 accessories,sony,dpw30r2h,8.88,268
walmart_1014,hercules dualpix emotion hd 720p usb webcam,electronics - general,hercules,4780655,47.82,749
walmart_5,3m fr530cb ergonomic adjustable footrest,furniture,3m,fr530cb,67.88,269
walmart_194,san diego chargers pro grip mouse,mice,team pro mark,msnf25,26.99,501
walmart_1831,da-lite matte white advantage manual with csr - av format 9 x 12 diagonal,electronics - general,da-lite,85691,1355.99,847
walmart_1299,sony h series np-fh50 actiforce infolithium battery hybrid,dvd accessories,sony,npfh50,38.0,272
walmart_1058,us brown bear super slim series medium ultra low profile led tv mount for 23 - 37 displays,furniture,us brown bear,,39.99,847
walmart_1359,sony bcvw1 ac charger for w series battery,photography - general,sony,bcvw1,44.88,273
walmart_624,viewsonic vg2236wm-led 22 1080p widescreen led monitor,monitors,viewsonic,vg2236wm-led,209.0,847
walmart_1767,oki 433244 toner 5000 page-yield,printers,oki,4.332442 e7,100.0,847
walmart_1466,roocase executive leather portfolio case for samsung galaxy tab p1000,electronics - general,roocase,212537,37.59,275
walmart_1061,da-lite high power model c manual screen - 9 x 12 av format,electronics - general,da-lite,83210,935.99,847
walmart_1312,philips usa 2 silicone cases for iphone 4 black white,electronics - general,philips,dlm4313/17,16.88,847
walmart_1551,blue crane nbc121 introduction to the canon 50d volume 1 basic controls dvd,camera and camcorder accessories,norazza,nbc121,19.0,847
walmart_687,startech.com pex1p 1 port pcie dp parallel adapter card,electronics - general,startech,pex1p,32.88,278
walmart_924,belkin shield micra for ipod touch tint,mp3 accessories,belkin,f8z646ttc01,47.88,847
walmart_481,imation 11864 slr-5 data cartridge,mp3 accessories,imation,11864,55.92,794
walmart_1165,polaroid 300 instant color film sheet,digital cameras,polaroid,pif-300,14.98,281
walmart_1459,sentry headart extreme folding headphones black,mp3 accessories,sentry,sentry dj style bk,12.98,847
walmart_177,human toolz 3-in-1 laptop pad designer tan,electronics - general,human toolz,3n1ndt,9.88,847
walmart_1249,jwin port amplified stereo speaker case for ipad blue,portable audio,jwin,isp210blu,62.88,847
walmart_1477,actiontec megaplug 85mbps powerline ethernet adapter kit two-pack,networking,actiontec,hle0850001k,69.99,396
walmart_1592,zax 87303 pro series 3m composite audio video cable,tv accessories,zax,87303,10.88,284
walmart_865,hello kitty computer accessories bundle with keyboard wireless mouse and usb flash drive,computers,,,48.0,847
walmart_2511,lg 42 class lcd 1080p 60hz hdtv 42lk450,electronics : flat panel tv,lg,42lk450,579.0,285
walmart_2375,case logic 48 capacity nylon cd dvd binder,electronics - general,case logic,87978,15.99,847
walmart_1294,avery shipping labels with trueblock technology 8-1 2 x 11 white 25 pack,stationery & office machinery,avery,8165,11.94,847
walmart_2009,edge 1gb 1x1gb pc25300 ecc unbuffered 240 pin ddr2 dimm,memory,edge,pe197780,26.82,847
walmart_680,cp technologies levelone oan-0501 omni-directional antenna,networking,cp tech,oan-0501,15.71,286
walmart_2539,ghent triumph display easel gray,stationery & office machinery,ghent,19250,26.09,287
walmart_1806,energizer lithium aaa battery,electronics - general,energizer,ea92bp-8,21.0,847
walmart_811,aleratec inc cd dvd shredder,stationery & office machinery,aleratec,,61.88,748
walmart_205,cleaning cards for canon cr-series check scanners,electronics - general,canon,1904v566,29.88,288
walmart_1939,epson s041667 premium glossy photo paper,photography - general,epson,s041667,45.2,847
walmart_2097,hp 564 tri-color combo inkjet cartridge cd994fn,printers,hp,hp cd994fn,26.5,847
walmart_2381,sony 30mm 37mm wide end conversion lens,photography - general,sony,vclhge08b,75.38,294
walmart_2470,canon cli-8y yellow inkjet print cartridge,printers,canon,2945b009aa,15.97,847
walmart_579,green onion supply rt-spipad01 glossy screen protector for apple ipad,mp3 accessories,green onions supply,rt-spipad01,40.18,720
walmart_949,trendnet tew-455apbo wireless super g high power outdoor poe access point,networking,trendnet,tew-455apbo,304.88,297
walmart_1716,post-it flags dispenser flags assorted-size assorted colors 340pk,stationery & office machinery,,ds420va,24.94,435
walmart_2040,skooba design skooba skin 1617 large laptop sleeve in blue microsuede with blue lining,electronics - general,skooba design,725-303,33.99,298
walmart_684,weyerhaeuser company multiuse premium paper 98 brightness 24lb 8-1 2 x 14 white 500 sheets ream,stationery & office machinery,,85781,12.47,483
walmart_1123,platt blow molded case in black 37x 10.5 x 3.75,electronics - general,platt,208,19.99,847
walmart_891,sabrent sata to ide ultra ata mini converter board,electronics - general,sabrent,sbt-scide,10.88,847
walmart_736,hammermill everyday copy and print paper 92 bright 20lb letter white 5000 sheets ctn,stationery & office machinery,hammermill,162008,46.47,847
walmart_1921,balt fold-n-stow workstation teak silver,furniture,balt,89904,164.94,847
walmart_629,acp-ep memory 16gb class 4 sdhc card,usb drives,ep memory,epsdhc/16gb -4,38.88,847
walmart_1025,kodak mini red video camera 1.8 lcd display,camcorders,kodak,mini video red,49.0,847
walmart_2393,adobe acrobat x standard upgrade from acrobat standard 7 8 9 windows,software,adobe,65096933,139.18,847
walmart_1894,justmobile xtand go flexible car mount for iphone 3 3g 4,electronics - general,macsense,st-169a,49.73,847
walmart_317,siig headrest ipad car mount,mp3 accessories,siig,ce-mt0e12-s1,40.88,299
walmart_204,bic mark-it retractable permanent marker fine red 1-dozen,stationery & office machinery,bic,pmr11-red,12.49,847
walmart_2426,hon 10500 workstation right pedestal desk 66w x 30d x 29-1 2h mahogany,furniture,hon,10584lnn,599.0,847
walmart_1057,s j paper file jackets with 1 1 2 expansion letter 11 pt . manila 50 ctn,stationery & office machinery,s j paper,,45.69,847
walmart_1846,canon psc-4100 deluxe soft case compatible with sx-30 canon camera,photography - general,canon,psc-4100,22.99,301
walmart_129,bushnell backtrack personal locator tech gray,handheld gps,bushnell,,49.99,847
walmart_902,midland behind-the-head 2-way radio headset 2-pack,phones,midland,avp-h5,22.27,302
walmart_134,panasonic sdr-s70s silver sd camcorder w 70x optical zoom 2.7 lcd display,camcorders,panasonic,panasonic sdr-s70-s,236.32,303
walmart_2141,griffin ipod touch 4g dflex protection system front only,mp3 accessories,griffin,na02046,19.88,304
walmart_2158,hp black notebook sleeve,electronics - general,hp,hp nu561aa,15.0,471
walmart_1832,arkon sgt-7ss sun shade for samsung galaxy tab,car stereos,arkon,sgt-7ss,16.88,306
walmart_903,scosche 1974-up ford chrysler jeep multi-purpose kit including 1999-up grand cherokee,automotive - general,scosche,fcj1276ab,11.37,824
